{
  "schema_version": "1.0.0",
  "policy_id": "aos-resource-os-zero-cost-first",
  "production": "NO_GO",
  "paid_api_fallback": "DISABLED",
  "resources": [
    {
      "resource_id": "local_qwen3_4b_q4_k_m_cpu",
      "backend_id": "qwen3_4b_llama_cpp",
      "backend_class": "REASONING_BACKEND",
      "enabled": true,
      "cost_class": "FREE_LOCAL",
      "api_key_fallback_enabled": false,
      "trust_zone": "SANDBOXED_LOCAL",
      "capabilities": ["MODEL_REASONING"],
      "scarcity_threshold": 0.0,
      "production_allowed": false,
      "sandbox": "loopback-only",
      "extensions": {
        "model_family": "Qwen3-4B",
        "quantization": "Q4_K_M",
        "runtime": "llama.cpp",
        "context_size": 4096,
        "max_output_tokens": 512,
        "max_parallel": 1,
        "memory_acceptance_bytes": 12884901888,
        "requires_machine_local_capability_attestation": true,
        "benchmark_required": true
      }
    },
    {
      "resource_id": "local_antigravity_subscription",
      "backend_id": "antigravity",
      "backend_class": "AGENTIC_EXECUTION_BACKEND",
      "enabled": true,
      "cost_class": "SUBSCRIPTION_INCLUDED",
      "api_key_fallback_enabled": false,
      "trust_zone": "RESTRICTED_WORKSPACE",
      "capabilities": [
        "FILE_READ",
        "FILE_WRITE",
        "PATCH_APPLY",
        "PROCESS_EXEC",
        "GIT_READ",
        "TEST_EXECUTION",
        "LONG_HORIZON_AGENTIC_WORK"
      ],
      "scarcity_threshold": 0.1,
      "production_allowed": false,
      "sandbox": "managed-workspace",
      "extensions": {
        "requires_machine_local_capability_attestation": true,
        "resume_policy": "EXACT_SESSION_AND_FINGERPRINT_ONLY"
      }
    },
    {
      "resource_id": "local_codex_cli_chatgpt_subscription",
      "backend_id": "codex_cli",
      "backend_class": "AGENTIC_EXECUTION_BACKEND",
      "enabled": true,
      "cost_class": "SUBSCRIPTION_INCLUDED",
      "api_key_fallback_enabled": false,
      "trust_zone": "RESTRICTED_WORKSPACE",
      "capabilities": [
        "FILE_READ",
        "FILE_WRITE",
        "PATCH_APPLY",
        "PROCESS_EXEC",
        "GIT_READ",
        "TEST_EXECUTION",
        "LONG_HORIZON_AGENTIC_WORK"
      ],
      "scarcity_threshold": 0.1,
      "production_allowed": false,
      "sandbox": "workspace-write",
      "extensions": {
        "requires_machine_local_capability_attestation": true,
        "required_auth_mode": "chatgpt",
        "resume_policy": "EXACT_UUID_AND_FINGERPRINT_ONLY",
        "paid_api_fallback": "DISABLED"
      }
    }
  ]
}
