{
  "schema_version": "1.0.0",
  "policy_id": "resource-os-test-policy",
  "production": "NO_GO",
  "paid_api_fallback": "DISABLED",
  "resources": [
    {
      "resource_id": "local_agentic_subscription",
      "backend_id": "agentic_backend",
      "backend_class": "AGENTIC_EXECUTION_BACKEND",
      "enabled": true,
      "cost_class": "SUBSCRIPTION_INCLUDED",
      "api_key_fallback_enabled": false,
      "trust_zone": "RESTRICTED_WORKSPACE",
      "capabilities": ["FILE_READ", "FILE_WRITE", "LONG_HORIZON_AGENTIC_WORK"],
      "scarcity_threshold": 0.1,
      "production_allowed": false,
      "sandbox": "workspace-write"
    }
  ]
}
